{
  "schema": 1,
  "contractVersion": "1.0.0",
  "factoryId": "win1",
  "name": "win1",
  "kind": null,
  "version": "0.1.0",
  "kitRevision": "abcdef012345",
  "generatedAt": "2026-10-02T10:00:00Z",
  "dashboardUrl": "https://win1.example",
  "health": {
    "status": "unknown",
    "tickAgeSeconds": null,
    "herdrReachable": null,
    "clockOffsetSeconds": null
  },
  "machine": {
    "load1": null,
    "load5": null,
    "load15": null,
    "cpus": null,
    "memoryTotalMb": null,
    "memoryFreePercent": null,
    "swapUsedMb": null,
    "diskFreePercent": null,
    "diskFreeMb": null,
    "utcOffsetMinutes": null
  },
  "workers": {
    "running": null,
    "max": null
  },
  "harnesses": [
    {
      "harness": "claude",
      "login": "unknown",
      "checkedAt": null
    }
  ],
  "boss": {
    "running": null,
    "harness": null
  },
  "pending": [
    {
      "step": "login-claude",
      "since": null
    }
  ],
  "backup": {
    "lastAt": null
  },
  "projects": [],
  "quotas": [],
  "spend": [],
  "alerts": [],
  "shareItemTitles": true,
  "ownerItems": {
    "total": 0,
    "needsOwner": 0,
    "rows": [
      {
        "id": "item-a",
        "kind": "answer",
        "title": "Confirm the sample owner"
      }
    ]
  },
  "reviewPacks": []
}
