{
  "schema": 1,
  "contractVersion": "1.0.0",
  "factoryId": "win2",
  "name": "win2",
  "version": "0.1.0",
  "kitRevision": "abcdef012345",
  "generatedAt": "2026-10-01T00:00:00Z",
  "dashboardUrl": "https://win2.example",
  "health": {
    "status": "unknown",
    "tickAgeSeconds": null,
    "herdrReachable": null,
    "clockOffsetSeconds": null
  },
  "machine": {
    "load1": null,
    "load5": null,
    "load15": null,
    "cpus": null,
    "memoryTotalMb": null,
    "memoryFreePercent": null,
    "swapUsedMb": null
  },
  "projects": [],
  "quotas": [],
  "spend": [],
  "alerts": [],
  "shareItemTitles": false,
  "ownerItems": {
    "total": 0,
    "needsOwner": 0,
    "rows": []
  },
  "reviewPacks": [],
  "claudeUsageHelper": {
    "state": "installed",
    "lastReadingSeconds": 42
  }
}
