{
  "schema": 1,
  "contractVersion": "1.2.0",
  "factoryId": "win2",
  "name": "win2",
  "version": "0.1.0",
  "kitRevision": "abcdef012345",
  "generatedAt": "2026-10-01T00:00:00Z",
  "dashboardUrl": "https://win2.example",
  "health": {
    "status": "unknown",
    "tickAgeSeconds": null,
    "herdrReachable": null,
    "clockOffsetSeconds": null
  },
  "machine": {
    "load1": null,
    "load5": null,
    "load15": null,
    "cpus": null,
    "memoryTotalMb": null,
    "memoryFreePercent": null,
    "swapUsedMb": null
  },
  "projects": [],
  "quotas": [
    {
      "harness": "codex",
      "accountScope": "this-factory",
      "lane": "weekly",
      "usedPercent": 37,
      "resetAt": "2026-10-09T10:00:00Z",
      "status": "ok"
    },
    {
      "harness": "opencode",
      "accountScope": "this-factory",
      "lane": "unknown",
      "usedPercent": null,
      "resetAt": "2026-10-09T10:00:00Z",
      "status": "unknown",
      "estimate": {
        "days": 7,
        "tokens": 270018600,
        "costUsd": 2.37,
        "omittedModels": 2
      }
    }
  ],
  "spend": [],
  "alerts": [],
  "shareItemTitles": false,
  "ownerItems": {
    "total": 0,
    "needsOwner": 0,
    "rows": []
  },
  "reviewPacks": []
}
